{
  "slug": "example-core",
  "loopback_port": 18181,
  "web_port": 8080,
  "api_port": 8081,
  "network_subnet": "172.30.241.0/28",
  "network_ip_range": "172.30.241.8/29",
  "postgres_image": "postgres@sha256:3645570cccdfa447589da9f57dd740faa29b30938e861289a5574b6ca6b03826",
  "nginx_image": "nginx@sha256:cc93106876eedec3e662e46adb019cd1d2cfae7ccdeb7eb411eeb932d90e9701",
  "python_image": "python@sha256:2b4f19dae3a777dfc3b76730bda1e82e1f66ab2a2686fa93ca78edbfb4f04ffe",
  "db_name": "example_commerce",
  "db_admin_user": "example_admin",
  "backend_directory": "backend",
  "app_memory": "1024m",
  "app_cpus": "1.0",
  "db_memory": "512m",
  "db_cpus": "0.5",
  "command_timeout": 1800,
  "compose_wait_seconds": 180,
  "max_body_bytes": 2097152,
  "proxy_connect_seconds": 5,
  "proxy_read_seconds": 60,
  "expected_static_release": "example-frontend-01",
  "environment": {
    "API_VERSION": "0.2.0",
    "ALLOWED_ORIGINS": "[\"https://commerce.example.test\"]",
    "EMBEDDING_ENABLED": "false",
    "EMBEDDING_MODEL": "REPLACE_WITH_VERIFIED_PUBLIC_MODEL",
    "EMBEDDING_REVISION": "REPLACE_WITH_EXACT_COMMIT",
    "EMBEDDING_REPOSITORY": "SET_FROM_BACKEND_VERIFIED_REPOSITORY",
    "EMBEDDING_MODEL_FILE": "SET_FROM_BACKEND_VERIFIED_FILE",
    "HEARTBEAT_TIMEOUT_SECONDS": "30",
    "SESSION_CREATIONS_PER_HOUR": "60",
    "MAX_PRODUCTS": "50"
  },
  "container_backup_directory": "/tmp",
  "db_runtime_user": "example_runtime",
  "postgres_service": "postgres",
  "postgres_port": 5432,
  "captured_stdout_bytes": 524288,
  "sftp_prefetch_requests": 16,
  "shopify_credentials_file": null
}
